{
  "blocked_human_gates": [
    {
      "gate_id": "GATE-ETHICS",
      "packet_path": "data/releases/task03_cross_cultural_experiment_v1/gates/GATE-ETHICS.json",
      "reasons": [
        "No ethics approval or approved data-management, withdrawal, retention and deletion procedure."
      ],
      "status": "blocked"
    },
    {
      "gate_id": "GATE-PARTICIPANTS",
      "packet_path": "data/releases/task03_cross_cultural_experiment_v1/gates/GATE-PARTICIPANTS.json",
      "reasons": [
        "Recruitment, compensation, quotas, stopping rules and model-based sample size are not approved."
      ],
      "status": "blocked"
    },
    {
      "gate_id": "GATE-TRANSLATION",
      "packet_path": "data/releases/task03_cross_cultural_experiment_v1/gates/GATE-TRANSLATION.json",
      "reasons": [
        "English, Japanese and Korean drafts lack human committee review, back-translation and cognitive interviews."
      ],
      "status": "blocked"
    },
    {
      "gate_id": "GATE-FORMAL-STIMULI",
      "packet_path": "data/releases/task03_cross_cultural_experiment_v1/gates/GATE-FORMAL-STIMULI.json",
      "reasons": [
        "TASK-01 formal stimulus entrypoint is blocked; only an open engineering fixture is allowed."
      ],
      "status": "blocked"
    },
    {
      "gate_id": "GATE-EXPERIMENT-RUNTIME",
      "packet_path": "data/releases/task03_cross_cultural_experiment_v1/gates/GATE-EXPERIMENT-RUNTIME.json",
      "reasons": [
        "A maintained experiment library or equivalent independent browser timing validation is required before a real pilot."
      ],
      "status": "blocked"
    }
  ],
  "contract_compatibility": {
    "backward_compatible": false,
    "previous_version": null,
    "reason": "First TASK-03 handoff; experiment_rating 2.0 is parallel to, not a silent replacement for, human_rating."
  },
  "contract_versions": {
    "consent_receipt": "1.1.0",
    "experiment_assignment": "1.0.0",
    "experiment_handoff_manifest": "2.0.0",
    "experiment_rating": "2.0.0",
    "experiment_stimulus_catalog": "1.0.0",
    "participant_profile": "1.0.0",
    "presentation_event": "1.0.0",
    "quality_decision": "1.0.0",
    "questionnaire_definition": "1.0.0",
    "study_protocol": "1.0.0"
  },
  "created_at": "2026-09-04T08:30:19Z",
  "handoff_schema_version": "2.0.0",
  "implementation_commit": "2048fa9866eb8cedc58b7399958331eae5f4325e",
  "input_snapshots": [
    {
      "logical_type": "task01_handoff",
      "path": "data/fixtures/asset_system/reference_handoff_v1/handoff_manifest.json",
      "privacy_level": "upstream_open_fixture",
      "record_count": 1,
      "schema_version": "2.0.0",
      "sha256": "acc193134495401b9a026aab0e7a866d7f15202b9b865db0d73d6f689bd1bdab",
      "validation_schema": "schema/handoff_manifest.schema.json"
    },
    {
      "logical_type": "study_protocol",
      "path": "configs/cross_cultural_study_v1.json",
      "privacy_level": "public_code_or_schema",
      "record_count": 1,
      "schema_version": "1.0.0",
      "sha256": "3681ca7e2050b270df04023e0c122a94919958f84f49d7498cd6482217f4d5f8",
      "validation_schema": "schema/study_protocol.schema.json"
    },
    {
      "logical_type": "questionnaire_definition",
      "path": "configs/questionnaire_v1.json",
      "privacy_level": "public_code_or_schema",
      "record_count": 1,
      "schema_version": "1.0.0",
      "sha256": "0d5a00eebfb6d1a6e5fe8ab26495061b26f5751048fc82f750c5034a737a7dca",
      "validation_schema": "schema/questionnaire_definition.schema.json"
    }
  ],
  "integration_requests": [
    {
      "reason": "Registers glyph-experiment and packages the experiment_system static browser assets; downstream integration must preserve these shared entrypoints.",
      "status": "included_in_implementation",
      "target": "pyproject.toml"
    }
  ],
  "known_limitations": [
    "Only the TASK-01 open synthetic fixture is presented; no formal stimulus is pilot-ready.",
    "Translations are drafts without committee review, back-translation or cognitive interviews.",
    "Power figures are assumption scenarios, not an approved sample size.",
    "The browser runtime has engineering checks but no mature-library or independent timing validation for real research.",
    "No real participant, recruitment, contact, compensation, withdrawal or retention workflow was exercised."
  ],
  "next_task_entrypoints": [
    {
      "notes": "Use stable item/condition definitions; expert terminology requires a separate reviewed block.",
      "path": "configs/questionnaire_v1.json",
      "status": "metadata_only",
      "task_id": "TASK-04"
    },
    {
      "notes": "Consume only deidentified schema-valid synthetic fixtures and preserve the formal-use block.",
      "path": "data/fixtures/experiment_system/reference_v1/records/reference_manifest.json",
      "status": "fixture_only",
      "task_id": "TASK-05"
    }
  ],
  "outputs": [
    {
      "logical_type": "questionnaire_entrypoint",
      "path": "configs/questionnaire_v1.json",
      "privacy_level": "public_code_or_schema",
      "record_count": 1,
      "schema_version": "1.0.0",
      "sha256": "0d5a00eebfb6d1a6e5fe8ab26495061b26f5751048fc82f750c5034a737a7dca",
      "validation_schema": "schema/questionnaire_definition.schema.json"
    },
    {
      "logical_type": "assignment_audit",
      "path": "data/fixtures/experiment_system/reference_v1/blocks/assignment_audit.json",
      "privacy_level": "synthetic_fixture",
      "record_count": 1,
      "schema_version": "1.0.0",
      "sha256": "72e6af68929ebc2b7247636ffd9211f5cb8ea11228031ff262dcbdc10c0208d3",
      "validation_schema": null
    },
    {
      "logical_type": "assignments",
      "path": "data/fixtures/experiment_system/reference_v1/blocks/assignments.jsonl",
      "privacy_level": "synthetic_fixture",
      "record_count": 4,
      "schema_version": "1.0.0",
      "sha256": "f3fca0087a898caec58cf0cc9bb578c668d57705f48d208761245ce5b27514a1",
      "validation_schema": "schema/experiment_assignment.schema.json"
    },
    {
      "logical_type": "stimulus_catalog",
      "path": "data/fixtures/experiment_system/reference_v1/blocks/stimulus_catalog.json",
      "privacy_level": "synthetic_fixture",
      "record_count": 1,
      "schema_version": "1.0.0",
      "sha256": "2e1ad6e42cb2c1e8c29586ef933e80f975e40042b7443368d754f8096bcaec4f",
      "validation_schema": "schema/experiment_stimulus_catalog.schema.json"
    },
    {
      "logical_type": "dry_run_summary",
      "path": "data/fixtures/experiment_system/reference_v1/dry_run_1000_seed_a.json",
      "privacy_level": "synthetic_fixture",
      "record_count": 1,
      "schema_version": "1.0.0",
      "sha256": "1c6be4627169e0533e53efab07a434e970b66f0b9c3a36f658ae3540ee4f339a",
      "validation_schema": null
    },
    {
      "logical_type": "dry_run_summary",
      "path": "data/fixtures/experiment_system/reference_v1/dry_run_1000_seed_b.json",
      "privacy_level": "synthetic_fixture",
      "record_count": 1,
      "schema_version": "1.0.0",
      "sha256": "cd8ea49cbf2ac410557260dab4616e808da303da0015c03057b29c80ddc37fca",
      "validation_schema": null
    },
    {
      "logical_type": "power_scenarios",
      "path": "data/fixtures/experiment_system/reference_v1/power_scenarios.json",
      "privacy_level": "synthetic_fixture",
      "record_count": 1,
      "schema_version": "1.0.0",
      "sha256": "bcee0357deca5e93043af2e5af79507e5e23e218404704c5c8294fe75b42a98a",
      "validation_schema": null
    },
    {
      "logical_type": "assignment",
      "path": "data/fixtures/experiment_system/reference_v1/records/assignment.json",
      "privacy_level": "synthetic_fixture",
      "record_count": 1,
      "schema_version": "1.0.0",
      "sha256": "ae10f7949204f23567c8a8389e276b70d4b2cf9c052920dcaa1420f839b9d069",
      "validation_schema": "schema/experiment_assignment.schema.json"
    },
    {
      "logical_type": "consent_receipt",
      "path": "data/fixtures/experiment_system/reference_v1/records/consent_receipt.json",
      "privacy_level": "synthetic_fixture",
      "record_count": 1,
      "schema_version": "1.1.0",
      "sha256": "29ec328ddd6f0121bb9cbe43ee8eb82cf27276a0361f9d91a8a34194c618e159",
      "validation_schema": "schema/consent_receipt.schema.json"
    },
    {
      "logical_type": "participant_profile",
      "path": "data/fixtures/experiment_system/reference_v1/records/participant_profile.json",
      "privacy_level": "synthetic_fixture",
      "record_count": 1,
      "schema_version": "1.0.0",
      "sha256": "f0a375e01d6bb32b3604d1368d5f30c38ff1bc50e61bb40054e450133a67f5a5",
      "validation_schema": "schema/participant_profile.schema.json"
    },
    {
      "logical_type": "presentation_event",
      "path": "data/fixtures/experiment_system/reference_v1/records/presentation_event.json",
      "privacy_level": "synthetic_fixture",
      "record_count": 1,
      "schema_version": "1.0.0",
      "sha256": "0918989701185798ed49b36236ed45f812a0f0c83f6a4844d5d065e15194aea6",
      "validation_schema": "schema/presentation_event.schema.json"
    },
    {
      "logical_type": "quality_decision",
      "path": "data/fixtures/experiment_system/reference_v1/records/quality_decision.json",
      "privacy_level": "synthetic_fixture",
      "record_count": 1,
      "schema_version": "1.0.0",
      "sha256": "09a23d12c766e93058f83eca405e1168a64225c937e13953fbdd98a8ba982be6",
      "validation_schema": "schema/quality_decision.schema.json"
    },
    {
      "logical_type": "questionnaire_definition",
      "path": "data/fixtures/experiment_system/reference_v1/records/questionnaire_definition.json",
      "privacy_level": "synthetic_fixture",
      "record_count": 1,
      "schema_version": "1.0.0",
      "sha256": "8ac285e5e361230f29b45b45ec758a05529e2a8299691982e56dce2413539ba4",
      "validation_schema": "schema/questionnaire_definition.schema.json"
    },
    {